{
  "headline": "One API for TYPO3.",
  "headline_accent": "Write it once, use it everywhere.",
  "lead": "The Action API turns a typed PHP method into a feature that the TYPO3 backend, external applications and AI agents can use: validated, documented and secured, without writing a single controller.",
  "target_version": "TYPO3 v15",
  "code": {
    "language": "php",
    "code": "#[AsAction(\n    type: ActionType::fetch,\n    name: 'my-extension/page/{uid}/titles',\n    summary: 'Fetch the titles of a page',\n    scopes: [ContentReadScope::class],\n)]\npublic function titles(int $uid): array\n{\n    // your business logic\n}"
  },
  "channels": [
    {
      "tab": "js",
      "icon": "UI",
      "title": "TYPO3 backend",
      "text": "JavaScript client, replaces AJAX routes"
    },
    {
      "tab": "http",
      "icon": "API",
      "title": "External applications",
      "text": "HTTP + JSON, OAuth 2.0 or token"
    },
    {
      "tab": "openapi",
      "icon": "DOC",
      "title": "API documentation",
      "text": "OpenAPI 3.1 and Swagger UI"
    },
    {
      "tab": "mcp",
      "icon": "AI",
      "title": "AI agents",
      "text": "MCP tools, over HTTP or stdio"
    }
  ],
  "facts": [
    {
      "title": "Write once",
      "text": "One PHP method serves the backend, integrations and AI agents."
    },
    {
      "title": "Typed and validated",
      "text": "JSON Schema derived from PHP types; input and output are checked."
    },
    {
      "title": "Secure by design",
      "text": "Runs as a backend user; scopes limit what an app may do."
    },
    {
      "title": "AI-ready",
      "text": "A built-in MCP server offers every action as a tool."
    }
  ]
}
